<?xml version="1.0" encoding="utf-8" ?>
<!--========================================================================-->
<!-- Copyright (c) 2018-2019 Qualcomm Technologies, Inc.                    -->
<!-- All Rights Reserved.                                                   -->
<!-- Confidential and Proprietary - Qualcomm Technologies, Inc.             -->
<!--========================================================================-->
<xs:schema xmlns:xs="http://www.w3.org/2001/XMLSchema">
	<xs:include schemaLocation="..\..\common\globalelements.xsd"/>
	<xs:include schemaLocation="aecglobalelements.xsd"/>

	<xs:element name="aecIr" type="AECIRType" />
	<xs:complexType name="AECIRType">
		<xs:sequence>
			<xs:element name="module_version">
				<xs:complexType>
					<xs:sequence>
						<xs:element name="major_revision" type="xs:int" fixed="1" />
						<xs:element name="minor_revision" type="xs:int" fixed="0" />
						<xs:element name="incr_revision" type="xs:int" fixed="0" />
					</xs:sequence>
				</xs:complexType>
			</xs:element>
			<xs:element name="IrMtr" type="IRMeteringType" />
			<xs:element name="IrConv" type="IRConvergenceType" />
			<xs:element name="IrArb" type="IRArbitrationType" />
		</xs:sequence>
	</xs:complexType>
	<xs:complexType name="IRMeteringType">
		<xs:sequence>
			<xs:element name="enableIR" default="0">
				<xs:complexType>
					<xs:simpleContent>
						<xs:extension base="xs:boolean">
							<xs:attribute name="type" default="bool" />
							<xs:attribute name="description" default="Flag to enable IR mode AEC" type="xs:string" />
							<xs:attribute name="default_value" default="0" type="xs:string" />
							<xs:attribute name="range" default="[0, 1]" type="xs:string" />
							<xs:attribute name="tuning_parameter_level" default="must_tune" type="tuning_level" />
						</xs:extension>
					</xs:simpleContent>
				</xs:complexType>
			</xs:element>
			<xs:element name="weightTables" type="WeightTableType"/>
			<xs:element name="vlDetect" type="VisiblelightDetectType"/>
		</xs:sequence>
	</xs:complexType>
	<xs:complexType name="IRLedAdjType">
		<xs:sequence>
			<xs:element name="enableIRled" default="0">
				<xs:complexType>
					<xs:simpleContent>
						<xs:extension base="xs:boolean">
							<xs:attribute name="type" default="bool" />
							<xs:attribute name="description" default="Flag to enable IR LED support" type="xs:string" />
							<xs:attribute name="range" default="[0, 1]" type="xs:string" />
							<xs:attribute name="tuning_parameter_level" default="must_tune" type="tuning_level" />
						</xs:extension>
					</xs:simpleContent>
				</xs:complexType>
			</xs:element>
			<xs:element name="minLedIntensityIdx" default="1.0">
				<xs:complexType>
					<xs:simpleContent>
						<xs:extension base="xs:float">
							<xs:attribute name="type" default="float" />
							<xs:attribute name="description" default="Minimum IR LED intensity Index" type="xs:string" />
							<xs:attribute name="range" default="[0,100]" type="xs:string" />
							<xs:attribute name="tuning_parameter_level" default="often_tune" type="tuning_level" />
						</xs:extension>
					</xs:simpleContent>
				</xs:complexType>
			</xs:element>
			<xs:element name="maxLedIntensityIdx" default="90.0">
				<xs:complexType>
					<xs:simpleContent>
						<xs:extension base="xs:float">
							<xs:attribute name="type" default="float" />
							<xs:attribute name="description" default="Maximum IR LED intensity Index" type="xs:string" />
							<xs:attribute name="range" default="[0,100]" type="xs:string" />
							<xs:attribute name="tuning_parameter_level" default="often_tune" type="tuning_level" />
						</xs:extension>
					</xs:simpleContent>
				</xs:complexType>
			</xs:element>
			<xs:element name="ledIntensityUnit" default="1.0">
				<xs:complexType>
					<xs:simpleContent>
						<xs:extension base="xs:float">
							<xs:attribute name="type" default="float" />
							<xs:attribute name="description" default="IR LED intensity percentage unit per Index" type="xs:string" />
							<xs:attribute name="range" default="[0,10]" type="xs:string" />
							<xs:attribute name="tuning_parameter_level" default="often_tune" type="tuning_level" />
						</xs:extension>
					</xs:simpleContent>
				</xs:complexType>
			</xs:element>
		</xs:sequence>
	</xs:complexType>
	<xs:complexType name="IRAlsAdjType">
		<xs:sequence>
			<xs:element name="enableAls" default="0">
				<xs:complexType>
					<xs:simpleContent>
						<xs:extension base="xs:boolean">
							<xs:attribute name="type" default="bool" />
							<xs:attribute name="description" default="Flag to enable IR ALS support" type="xs:string" />
							<xs:attribute name="range" default="[0, 1]" type="xs:string" />
							<xs:attribute name="tuning_parameter_level" default="must_tune" type="tuning_level" />
						</xs:extension>
					</xs:simpleContent>
				</xs:complexType>
			</xs:element>
			<xs:element name="day2irSwitchPt" default="100.0">
				<xs:complexType>
					<xs:simpleContent>
						<xs:extension base="xs:float">
							<xs:attribute name="type" default="float" />
							<xs:attribute name="description" default="The value of ALS to switch day mode to ir mode" type="xs:string" />
							<xs:attribute name="tuning_parameter_level" default="often_tune" type="tuning_level" />
						</xs:extension>
					</xs:simpleContent>
				</xs:complexType>
			</xs:element>
			<xs:element name="ir2daySwitchPt" default="1000.0">
				<xs:complexType>
					<xs:simpleContent>
						<xs:extension base="xs:float">
							<xs:attribute name="type" default="float" />
							<xs:attribute name="description" default="The value of ALS to switch ir mode to day mode" type="xs:string" />
							<xs:attribute name="tuning_parameter_level" default="often_tune" type="tuning_level" />
						</xs:extension>
					</xs:simpleContent>
				</xs:complexType>
			</xs:element>
		</xs:sequence>
	</xs:complexType>
	<xs:complexType name="WeightTableType">
		<xs:sequence>
			<xs:element name="centerWeighted">
				<xs:complexType>
					<xs:sequence>
						<xs:element name="weights">
							<xs:simpleType>
								<xs:restriction base="floatvar">
									<xs:length value="256"/>
								</xs:restriction>
							</xs:simpleType>
						</xs:element>
					</xs:sequence>
					<xs:attribute name="type" default="float"/>
					<xs:attribute name="description" default="Center weighted metering weight table."/>
					<xs:attribute name="range" default="[0,1]"/>
					<xs:attribute name="length" type="xs:int" fixed="256"/>
					<xs:attribute name="tuning_parameter_level" type="tuning_level" default="often_tune"/>
				</xs:complexType>
			</xs:element>
			<xs:element name="LumaWeighted">
				<xs:complexType>
					<xs:sequence>
						<xs:element name="weights">
							<xs:simpleType>
								<xs:restriction base="floatvar">
									<xs:length value="64"/>
								</xs:restriction>
							</xs:simpleType>
						</xs:element>
					</xs:sequence>
					<xs:attribute name="type" default="float"/>
					<xs:attribute name="description" default="Highlight suppress weight table."/>
					<xs:attribute name="range" default="[0,1]"/>
					<xs:attribute name="length" type="xs:int" fixed="64"/>
					<xs:attribute name="tuning_parameter_level" type="tuning_level" default="often_tune"/>
				</xs:complexType>
			</xs:element>
		</xs:sequence>
	</xs:complexType>
	<xs:complexType name="IRConvergenceType">
		<xs:sequence>
			<xs:element name="irSkipFrameCnt" default="3">
				<xs:complexType>
					<xs:simpleContent>
						<xs:extension base="xs:int">
							<xs:attribute name="type" default="int" />
							<xs:attribute name="description" default="Skip frames of AEC after IR cut switched" type="xs:string" />
							<xs:attribute name="tuning_parameter_level" default="rarely_tune" type="tuning_level" />
						</xs:extension>
					</xs:simpleContent>
				</xs:complexType>
			</xs:element>
			<xs:element name="convSpeedAdjRatio" default="1.0">
				<xs:complexType>
					<xs:simpleContent>
						<xs:extension base="xs:float">
							<xs:attribute name="type" default="float" />
							<xs:attribute name="description" default="Specify the adjustment of convergence speed during IR AEC convergence" type="xs:string" />
							<xs:attribute name="range" default="[0.0, 1.0]" type="xs:string" />
							<xs:attribute name="tuning_parameter_level" default="often_tune" type="tuning_level" />
						</xs:extension>
					</xs:simpleContent>
				</xs:complexType>
			</xs:element>
		</xs:sequence>
	</xs:complexType>
	<xs:complexType name="VisiblelightDetectType">
		<xs:sequence>
			<xs:element name="enable" default="0">
				<xs:complexType>
					<xs:simpleContent>
						<xs:extension base="xs:boolean">
							<xs:attribute name="type" default="bool" />
							<xs:attribute name="description" default="Flag to enable visible light detection" type="xs:string" />
							<xs:attribute name="range" default="[0, 1]" type="xs:string" />
							<xs:attribute name="tuning_parameter_level" default="must_tune" type="tuning_level" />
						</xs:extension>
					</xs:simpleContent>
				</xs:complexType>
			</xs:element>
			<xs:element name="visibleLightCntThres" default="0.3">
				<xs:complexType>
					<xs:simpleContent>
						<xs:extension base="xs:float">
							<xs:attribute name="type" default="float" />
							<xs:attribute name="description" default="Count threshold of visible light detection" type="xs:string" />
							<xs:attribute name="range" default="[0, 1]" type="xs:string" />
							<xs:attribute name="tuning_parameter_level" default="often_tune" type="tuning_level" />
						</xs:extension>
					</xs:simpleContent>
				</xs:complexType>
			</xs:element>
			<xs:element name="visibleLightTargetThres" default="0.5">
				<xs:complexType>
					<xs:simpleContent>
						<xs:extension base="xs:float">
							<xs:attribute name="type" default="float" />
							<xs:attribute name="description" default="Target threshold of visible light detection" type="xs:string" />
							<xs:attribute name="range" default="[0, 1]" type="xs:string" />
							<xs:attribute name="tuning_parameter_level" default="often_tune" type="tuning_level" />
						</xs:extension>
					</xs:simpleContent>
				</xs:complexType>
			</xs:element>
			<xs:element name="irLightRangeBG" minOccurs="2" maxOccurs="2">
				<xs:complexType>
					<xs:simpleContent>
						<xs:extension base="xs:float">
							<xs:attribute name="type" default="float"/>
							<xs:attribute name="description" type="xs:string" default="BG ratio to detect visible light."/>
							<xs:attribute name="tuning_parameter_level" type="tuning_level" default="rarely_tune"/>
						</xs:extension>
					</xs:simpleContent>
				</xs:complexType>
			</xs:element>
			<xs:element name="irLightRangeRG" minOccurs="2" maxOccurs="2">
				<xs:complexType>
					<xs:simpleContent>
						<xs:extension base="xs:float">
							<xs:attribute name="type" default="float"/>
							<xs:attribute name="description" type="xs:string" default="RG ratio to detect visible light."/>
							<xs:attribute name="tuning_parameter_level" type="tuning_level" default="rarely_tune"/>
						</xs:extension>
					</xs:simpleContent>
				</xs:complexType>
			</xs:element>
			<xs:element name="irLightRangeRB" minOccurs="2" maxOccurs="2">
				<xs:complexType>
					<xs:simpleContent>
						<xs:extension base="xs:float">
							<xs:attribute name="type" default="float"/>
							<xs:attribute name="description" type="xs:string" default="RB ratio to detect visible light."/>
							<xs:attribute name="tuning_parameter_level" type="tuning_level" default="rarely_tune"/>
						</xs:extension>
					</xs:simpleContent>
				</xs:complexType>
			</xs:element>
			<xs:element name="wTable">
				<xs:complexType>
					<xs:sequence>
						<xs:element name="weights">
							<xs:simpleType>
								<xs:restriction base="floatvar">
									<xs:length value="256"/>
								</xs:restriction>
							</xs:simpleType>
						</xs:element>
					</xs:sequence>
					<xs:attribute name="type" default="float"/>
					<xs:attribute name="description" default="Weight table for detecting visible light."/>
					<xs:attribute name="range" default="[0,1]"/>
					<xs:attribute name="length" type="xs:int" fixed="256"/>
					<xs:attribute name="tuning_parameter_level" type="tuning_level" default="rarely_tune"/>
				</xs:complexType>
			</xs:element>
		</xs:sequence>
	</xs:complexType>
	<xs:complexType name="IRArbitrationType">
		<xs:sequence>
			<xs:element name="day2irCheckExpIdx" default="224.0">
				<xs:complexType>
					<xs:simpleContent>
						<xs:extension base="xs:float">
							<xs:attribute name="type" default="float" />
							<xs:attribute name="description" default="Day to IR exp_index to trigger IR LED" type="xs:string" />
							<xs:attribute name="tuning_parameter_level" default="often_tune" type="tuning_level" />
						</xs:extension>
					</xs:simpleContent>
				</xs:complexType>
			</xs:element>
			<xs:element name="ir2dayCheckExpIdx" default="184.0">
				<xs:complexType>
					<xs:simpleContent>
						<xs:extension base="xs:float">
							<xs:attribute name="type" default="float" />
							<xs:attribute name="description" default="IR to Day exp_index to turn off IR LED" type="xs:string" />
							<xs:attribute name="tuning_parameter_level" default="often_tune" type="tuning_level" />
						</xs:extension>
					</xs:simpleContent>
				</xs:complexType>
			</xs:element>
			<xs:element name="day2irCheckCnt" default="3">
				<xs:complexType>
					<xs:simpleContent>
						<xs:extension base="xs:int">
							<xs:attribute name="type" default="int" />
							<xs:attribute name="description" default="Stable count while switching Day to IR mode" type="xs:string" />
							<xs:attribute name="tuning_parameter_level" default="rarely_tune" type="tuning_level" />
						</xs:extension>
					</xs:simpleContent>
				</xs:complexType>
			</xs:element>
			<xs:element name="ir2dayCheckCnt" default="3">
				<xs:complexType>
					<xs:simpleContent>
						<xs:extension base="xs:int">
							<xs:attribute name="type" default="int" />
							<xs:attribute name="description" default="Stable count while switching IR to Day mode" type="xs:string" />
							<xs:attribute name="tuning_parameter_level" default="rarely_tune" type="tuning_level" />
						</xs:extension>
					</xs:simpleContent>
				</xs:complexType>
			</xs:element>
			<xs:element name="irSwitchCheckSkipCnt" default="5">
				<xs:complexType>
					<xs:simpleContent>
						<xs:extension base="xs:int">
							<xs:attribute name="type" default="int" />
							<xs:attribute name="description" default="Check period of Day/Night switch" type="xs:string" />
							<xs:attribute name="tuning_parameter_level" default="rarely_tune" type="tuning_level" />
						</xs:extension>
					</xs:simpleContent>
				</xs:complexType>
			</xs:element>
			<xs:element name="irSwitchChangeSkipCnt" default="30">
				<xs:complexType>
					<xs:simpleContent>
						<xs:extension base="xs:int">
							<xs:attribute name="type" default="int" />
							<xs:attribute name="description" default="Check period after Day/Night switched" type="xs:string" />
							<xs:attribute name="tuning_parameter_level" default="rarely_tune" type="tuning_level" />
						</xs:extension>
					</xs:simpleContent>
				</xs:complexType>
			</xs:element>
			<xs:element name="irDriverType" default="0">
				<xs:complexType>
					<xs:simpleContent>
						<xs:extension base="xs:int">
							<xs:attribute name="type" default="int" />
							<xs:attribute name="description" default="LED driver control type: GPIO:0, PWM:1" type="xs:string" />
							<xs:attribute name="tuning_parameter_level" default="rarely_tune" type="tuning_level" />
						</xs:extension>
					</xs:simpleContent>
				</xs:complexType>
			</xs:element>
			<xs:element name="irLedAdj" type="IRLedAdjType"/>
			<xs:element name="irAlsAdj" type="IRAlsAdjType"/>		
		</xs:sequence>
	</xs:complexType>
</xs:schema>
